{
  "schema_version": "1.0",
  "work_id": "shakespeare-king-lear",
  "title": "King Lear",
  "author": "William Shakespeare",
  "language": "en",
  "source_type": "gutenberg_single",
  "canonical_text": "canonical.txt",
  "canonical_sha256": "7af42d74a0657fb4f9b42d0ee03dcf176fbeab22a331185e001e9c44382472e0",
  "source_references": [
    "provenance/sources/shakespeare-king-lear-context-v1.json",
    "data/acquisition/context_extension_3_v1/selection.json"
  ],
  "rights": {
    "analysis_allowed": true,
    "public_render_policy": "PUBLIC_DOMAIN_FULL_CONTEXT_OK"
  },
  "notes": "Project Gutenberg 1532, modern-spelling text, original English. Removed Gutenberg START/END wrapper only. All five acts and 26 scenes retained, with front matter. Source line endings normalized to LF before section offsets are calculated."
}
