{
  "schema_version": "1.0",
  "work_id": "gissing-the-odd-women",
  "title": "The Odd Women",
  "author": "George Gissing",
  "language": "en",
  "source_type": "gutenberg_single",
  "canonical_text": "canonical.txt",
  "canonical_sha256": "8b092fbf41dbb93d6282ff84fd73c0ef356dbe45291901fc5bfef56ea93a7a07",
  "source_references": [
    "provenance/sources/gutenberg-4313.json",
    "data/acquisition/commitment_extension_5_v1/selection.json"
  ],
  "rights": {
    "analysis_allowed": true,
    "public_render_policy": "PUBLIC_DOMAIN_FULL_CONTEXT_OK"
  },
  "notes": "Targeted exploratory commitment extension, commitment_extension_5_v1. Economic dependence, courtship commitments, and demands for verbal reassurance. Chapter XVI's demand and evasion are contextual controls, not completed ILY utterances. "
}
